Date,Location,Total of Attendees,Purpose of Hospitality,Type of Event,Claim,Supplier,Total
2022/10/13,Milton,12,To meet constituents,Hosting a meeting,M0315784,Domino's Pizza,22.09
2022/10/13,Milton,12,To meet constituents,Hosting a meeting,M0315784,Tim Hortons,35.98
2022/10/28,Milton,200,To meet constituents,"Gala, reception or ceremony",M0319205,Halton Catholic Children's Foundation,100.00
2022/10/29,Milton,0,To celebrate a significant event,"Gala, reception or ceremony",M0318961,Milton District Hospital Foundation,140.00
2022/11/10,Milton,100,To meet constituents,Hosting a town hall or community event,M0320698,KASE Insurance Inc.,226.97
2022/11/10,Milton,100,To meet constituents,Hosting a town hall or community event,M0320698,Tim Hortons,79.96
2022/11/11,Milton,20,To meet constituents,Community activity or event,M0320540,Tim Hortons,19.99
